{
  "type": "zip",
  "name": "mingw64",
  "filename": "mingw64.7z",
  "filenames": null,
  "url": "https://sourceforge.net/projects/mingw-w64/files/Toolchains%20targetting%20Win64/Personal%20Builds/mingw-builds/8.1.0/threads-posix/seh/x86_64-8.1.0-release-posix-seh-rt_v6-rev0.7z/download",
  "urls": null,
  "installPath": "C:\\",
  "installRoot": "C:\\mingw64",
  "pathVar": "C:\\mingw64\\bin",
  "guid": null,
  "installArguments": null,
  "removeArguments": null,
  "removeCommands": null,
  "log": false,
  "dirArgument": null,
  "downloadBeforeRemove": false,
  "downloadBeforeInstall": true
}