{
    "type": "msi",
    "name": "Dr. Memory",
    "filename": "drmemory.msi",
	"filenames": null,
    "url": "https://github.com/DynamoRIO/drmemory/releases/download/release_1.11.0/DrMemory-Windows-1.11.0-2.msi",
	"urls": null,
	"installPath": null,
	"installRoot": null,
	"pathVar": "C:\\Program Files (x86)\\Dr. Memory\\bin",
    "guid": "{67675AD6-1FB0-4DE1-9ECF-84997515025E}",
    "installArguments": "",
	"removeArguments": null,
	"removeCommands": null,
	"log": false,
	"dirArgument": null,
	"downloadBeforeRemove": false,
	"downloadBeforeInstall": true
}