{
    "type": "zip",
    "name": "System Internals",
    "filename": "SysinternalsSuite.zip",
    "filenames": [
        "C:\\Utils\\ADInsight.chm",
        "C:\\Utils\\ADExplorer.exe",
        "C:\\Utils\\ADInsight.exe",
        "C:\\Utils\\AccessEnum.exe",
        "C:\\Utils\\AdExplorer.chm",
        "C:\\Utils\\Autologon.exe",
        "C:\\Utils\\Autoruns.exe",
        "C:\\Utils\\Autoruns64.dll",
        "C:\\Utils\\Autoruns64.exe",
        "C:\\Utils\\Bginfo.exe",
        "C:\\Utils\\Bginfo64.exe",
        "C:\\Utils\\Cacheset.exe",
        "C:\\Utils\\Clockres.exe",
        "C:\\Utils\\Clockres64.exe",
        "C:\\Utils\\Contig.exe",
        "C:\\Utils\\Contig64.exe",
        "C:\\Utils\\Coreinfo.exe",
        "C:\\Utils\\DISKMON.HLP",
        "C:\\Utils\\DMON.SYS",
        "C:\\Utils\\Dbgview.exe",
        "C:\\Utils\\Desktops.exe",
        "C:\\Utils\\Disk2vhd.chm",
        "C:\\Utils\\DiskView.exe",
        "C:\\Utils\\Diskmon.exe",
        "C:\\Utils\\Eula.txt",
        "C:\\Utils\\FindLinks.exe",
        "C:\\Utils\\FindLinks64.exe",
        "C:\\Utils\\Listdlls.exe",
        "C:\\Utils\\Listdlls64.exe",
        "C:\\Utils\\LoadOrd.exe",
        "C:\\Utils\\LoadOrd64.exe",
        "C:\\Utils\\LoadOrdC.exe",
        "C:\\Utils\\LoadOrdC64.exe",
        "C:\\Utils\\PORTMON.CNT",
        "C:\\Utils\\PORTMON.HLP",
        "C:\\Utils\\Procmon.exe",
        "C:\\Utils\\PsExec.exe",
        "C:\\Utils\\PsExec64.exe",
        "C:\\Utils\\PsGetsid.exe",
        "C:\\Utils\\PsGetsid64.exe",
        "C:\\Utils\\PsInfo.exe",
        "C:\\Utils\\PsInfo64.exe",
        "C:\\Utils\\PsLoggedon.exe",
        "C:\\Utils\\PsLoggedon64.exe",
        "C:\\Utils\\PsService.exe",
        "C:\\Utils\\PsService64.exe",
        "C:\\Utils\\Pstools.chm",
        "C:\\Utils\\RAMMap.exe",
        "C:\\Utils\\RegDelNull.exe",
        "C:\\Utils\\RegDelNull64.exe",
        "C:\\Utils\\ShareEnum.exe",
        "C:\\Utils\\ShellRunas.exe",
        "C:\\Utils\\Sysmon.exe",
        "C:\\Utils\\Sysmon64.exe",
        "C:\\Utils\\TCPVIEW.HLP",
        "C:\\Utils\\Tcpvcon.exe",
        "C:\\Utils\\Tcpview.exe",
        "C:\\Utils\\Testlimit.exe",
        "C:\\Utils\\Testlimit64.exe",
        "C:\\Utils\\Vmmap.chm",
        "C:\\Utils\\Volumeid.exe",
        "C:\\Utils\\Volumeid64.exe",
        "C:\\Utils\\WINOBJ.HLP",
        "C:\\Utils\\Winobj.exe",
        "C:\\Utils\\ZoomIt.exe",
        "C:\\Utils\\accesschk.exe",
        "C:\\Utils\\accesschk64.exe",
        "C:\\Utils\\adrestore.exe",
        "C:\\Utils\\autoruns.chm",
        "C:\\Utils\\autorunsc.exe",
        "C:\\Utils\\autorunsc64.exe",
        "C:\\Utils\\ctrl2cap.amd.sys",
        "C:\\Utils\\ctrl2cap.exe",
        "C:\\Utils\\ctrl2cap.nt4.sys",
        "C:\\Utils\\ctrl2cap.nt5.sys",
        "C:\\Utils\\dbgview.chm",
        "C:\\Utils\\disk2vhd.exe",
        "C:\\Utils\\diskext.exe",
        "C:\\Utils\\diskext64.exe",
        "C:\\Utils\\du.exe",
        "C:\\Utils\\du64.exe",
        "C:\\Utils\\efsdump.exe",
        "C:\\Utils\\handle.exe",
        "C:\\Utils\\handle64.exe",
        "C:\\Utils\\hex2dec.exe",
        "C:\\Utils\\hex2dec64.exe",
        "C:\\Utils\\junction.exe",
        "C:\\Utils\\junction64.exe",
        "C:\\Utils\\ldmdump.exe",
        "C:\\Utils\\livekd.exe",
        "C:\\Utils\\livekd64.exe",
        "C:\\Utils\\logonsessions.exe",
        "C:\\Utils\\logonsessions64.exe",
        "C:\\Utils\\movefile.exe",
        "C:\\Utils\\movefile64.exe",
        "C:\\Utils\\notmyfault.exe",
        "C:\\Utils\\notmyfault64.exe",
        "C:\\Utils\\notmyfaultc.exe",
        "C:\\Utils\\notmyfaultc64.exe",
        "C:\\Utils\\ntfsinfo.exe",
        "C:\\Utils\\ntfsinfo64.exe",
        "C:\\Utils\\pagedfrg.exe",
        "C:\\Utils\\pagedfrg.hlp",
        "C:\\Utils\\pendmoves.exe",
        "C:\\Utils\\pendmoves64.exe",
        "C:\\Utils\\pipelist.exe",
        "C:\\Utils\\pipelist64.exe",
        "C:\\Utils\\portmon.exe",
        "C:\\Utils\\procdump.exe",
        "C:\\Utils\\procdump64.exe",
        "C:\\Utils\\procexp.chm",
        "C:\\Utils\\procexp.exe",
        "C:\\Utils\\procexp64.exe",
        "C:\\Utils\\procmon.chm",
        "C:\\Utils\\psfile.exe",
        "C:\\Utils\\psfile64.exe",
        "C:\\Utils\\pskill.exe",
        "C:\\Utils\\pskill64.exe",
        "C:\\Utils\\pslist.exe",
        "C:\\Utils\\pslist64.exe",
        "C:\\Utils\\psloglist.exe",
        "C:\\Utils\\psloglist64.exe",
        "C:\\Utils\\pspasswd.exe",
        "C:\\Utils\\pspasswd64.exe",
        "C:\\Utils\\psping.exe",
        "C:\\Utils\\psping64.exe",
        "C:\\Utils\\psshutdown.exe",
        "C:\\Utils\\pssuspend.exe",
        "C:\\Utils\\pssuspend64.exe",
        "C:\\Utils\\psversion.txt",
        "C:\\Utils\\readme.txt",
        "C:\\Utils\\regjump.exe",
        "C:\\Utils\\ru.exe",
        "C:\\Utils\\ru64.exe",
        "C:\\Utils\\sdelete.exe",
        "C:\\Utils\\sdelete64.exe",
        "C:\\Utils\\sigcheck.exe",
        "C:\\Utils\\sigcheck64.exe",
        "C:\\Utils\\streams.exe",
        "C:\\Utils\\streams64.exe",
        "C:\\Utils\\strings.exe",
        "C:\\Utils\\strings64.exe",
        "C:\\Utils\\sync.exe",
        "C:\\Utils\\sync64.exe",
        "C:\\Utils\\tcpview.chm",
        "C:\\Utils\\vmmap.exe",
        "C:\\Utils\\whois.exe",
        "C:\\Utils\\whois64.exe"
    ],
    "url": "https://download.sysinternals.com/files/SysinternalsSuite.zip",
    "urls": null,
    "installPath": "C:\\utils",
    "installRoot": "C:\\utils",
    "pathVar": "C:\\utils",
    "guid": null,
    "installArguments": null,
    "removeArguments": null,
    "removeCommands": null,
    "log": false,
    "dirArgument": null,
    "downloadBeforeRemove": false,
    "downloadBeforeInstall": true
}