{
  "type": "exe",
  "name": "Doxygen",
  "filename": "doxygen.exe",
  "filenames": null,
  "url": "https://sourceforge.net/projects/doxygen/files/rel-1.8.6/doxygen-1.8.6-setup.exe/download",
  "urls": null,
  "installPath": null,
  "installRoot": null,
  "pathVar": "C:\\Program Files\\doxygen\\bin",
  "guid": "doxygen_is1",
  "installArguments": "/sp- /verysilent /norestart",
  "removeArguments": "/VERYSILENT /SUPPRESSMSGBOXES /NORESTART",
  "removeCommands": null,
  "log": true,
  "dirArgument": "DIR",
  "downloadBeforeRemove": false,
  "downloadBeforeInstall": true
}