{
  "type": "exe",
  "name": "Visual Studio Build Tools 2017",
  "filename": "vs_buildtools.exe",
  "filenames": null,
  "url": "https://aka.ms/vs/15/release/vs_buildtools.exe",
  "urls": null,
  "installPath": null,
  "installRoot": null,
  "pathVar": null,
  "guid": null,
  "installArguments": "--quiet --norestart --nocache --wait --add \"Microsoft.VisualStudio.Component.Roslyn.Compiler\" --add \"Microsoft.Component.MSBuild\" --add \"Microsoft.VisualStudio.Component.CoreBuildTools\" --add \"Microsoft.VisualStudio.Workload.MSBuildTools\" --add \"Microsoft.VisualStudio.Component.Windows10SDK\" --add \"Microsoft.VisualStudio.Component.VC.CoreBuildTools\" --add \"Microsoft.VisualStudio.Component.Static.Analysis.Tools\" --add \"Microsoft.VisualStudio.Component.VC.Tools.x86.x64\" --add \"Microsoft.VisualStudio.Component.VC.Redist.14.Latest\" --add \"Microsoft.VisualStudio.Component.Windows10SDK.17763\" --add \"Microsoft.VisualStudio.Component.VC.CMake.Project\" --add \"Microsoft.VisualStudio.Component.TestTools.BuildTools\" --add \"Microsoft.VisualStudio.Component.VC.Tools.ARM\" --add \"Microsoft.VisualStudio.Workload.VCTools\" --add \"Microsoft.VisualStudio.Component.NuGet.BuildTools\" --add \"Microsoft.Net.Component.4.5.TargetingPack\"",
  "removeArguments": null,
  "removeCommands": [
    "--quiet --norestart --nocache --wait --remove \"Microsoft.VisualStudio.Component.Roslyn.Compiler\" --remove \"Microsoft.Component.MSBuild\" --remove \"Microsoft.VisualStudio.Component.CoreBuildTools\" --remove \"Microsoft.VisualStudio.Workload.MSBuildTools\" --remove \"Microsoft.VisualStudio.Component.Windows10SDK\" --remove \"Microsoft.VisualStudio.Component.VC.CoreBuildTools\" --remove \"Microsoft.VisualStudio.Component.Static.Analysis.Tools\" --remove \"Microsoft.VisualStudio.Component.VC.Tools.x86.x64\" --remove \"Microsoft.VisualStudio.Component.VC.Redist.14.Latest\" --remove \"Microsoft.VisualStudio.Component.Windows10SDK.17763\" --remove \"Microsoft.VisualStudio.Component.VC.CMake.Project\" --remove \"Microsoft.VisualStudio.Component.TestTools.BuildTools\" --remove \"Microsoft.VisualStudio.Component.VC.Tools.ARM\" --remove \"Microsoft.VisualStudio.Workload.VCTools\" --remove \"Microsoft.VisualStudio.Component.NuGet.BuildTools\" --remove \"Microsoft.Net.Component.4.5.TargetingPack\""
  ],
  "log": false,
  "dirArgument": null,
  "downloadBeforeRemove": true,
  "downloadBeforeInstall": true
}
